{
  "contract_version": "1.0.0",
  "generated_at": "2026-10-01T07:30:00+10:00",
  "mode": "full",
  "days": 5,
  "courses": [
    {
      "slug": "woollahra",
      "name": "Woollahra Golf Club",
      "region": "Eastern Suburbs",
      "host": "woollahra.miclub.com.au",
      "fee_group_id": "3050666",
      "holes": 9,
      "par": 34,
      "length_metres": null,
      "drive_minutes_from_bondi": 10,
      "requires_registration": false,
      "address": null,
      "notes": "Weekend public play is 9 holes only. Twilight pricing kicks in around 4pm.",
      "sort_order": 0
    },
    {
      "slug": "eastlake",
      "name": "Eastlake Golf Club",
      "region": "Eastern Suburbs",
      "host": "www.eastlakegolfclub.com.au",
      "fee_group_id": "3784606",
      "holes": 18,
      "par": 72,
      "length_metres": null,
      "drive_minutes_from_bondi": 15,
      "requires_registration": false,
      "address": null,
      "notes": "",
      "sort_order": 1
    },
    {
      "slug": "the-coast",
      "name": "The Coast Golf Club",
      "region": "Eastern Suburbs",
      "host": "www.coastgolf.com.au",
      "fee_group_id": "1508176600",
      "holes": 18,
      "par": 71,
      "length_metres": null,
      "drive_minutes_from_bondi": 25,
      "requires_registration": false,
      "address": null,
      "notes": "Little Bay, ocean cliff course.",
      "sort_order": 2
    },
    {
      "slug": "strathfield",
      "name": "Strathfield Golf Club",
      "region": "Inner West",
      "host": "www.strathfieldgolf.com.au",
      "fee_group_id": "1514453417",
      "holes": 18,
      "par": 71,
      "length_metres": null,
      "drive_minutes_from_bondi": 25,
      "requires_registration": false,
      "address": null,
      "notes": "Members club — may have limited public availability.",
      "sort_order": 3
    },
    {
      "slug": "north-ryde",
      "name": "North Ryde Golf Club",
      "region": "North Shore",
      "host": "northryde.miclub.com.au",
      "fee_group_id": "5351785",
      "holes": 18,
      "par": 69,
      "length_metres": null,
      "drive_minutes_from_bondi": 28,
      "requires_registration": false,
      "address": null,
      "notes": "",
      "sort_order": 4
    },
    {
      "slug": "wakehurst",
      "name": "Wakehurst Golf Club",
      "region": "Northern Beaches",
      "host": "wakehurst.miclub.com.au",
      "fee_group_id": "1510657214",
      "holes": 18,
      "par": 72,
      "length_metres": null,
      "drive_minutes_from_bondi": 28,
      "requires_registration": false,
      "address": null,
      "notes": "Seaforth, beside Garigal National Park.",
      "sort_order": 5
    },
    {
      "slug": "northbridge",
      "name": "Northbridge Golf Club",
      "region": "North Shore",
      "host": "northbridge.miclub.com.au",
      "fee_group_id": "132857",
      "holes": 18,
      "par": 64,
      "length_metres": null,
      "drive_minutes_from_bondi": 30,
      "requires_registration": false,
      "address": null,
      "notes": "Short, hilly course — par 64.",
      "sort_order": 6
    },
    {
      "slug": "bexley",
      "name": "Bexley Golf Club",
      "region": "St George",
      "host": "bexley.miclub.com.au",
      "fee_group_id": "5315151",
      "holes": 18,
      "par": 64,
      "length_metres": null,
      "drive_minutes_from_bondi": 30,
      "requires_registration": false,
      "address": null,
      "notes": "",
      "sort_order": 7
    },
    {
      "slug": "beverley-park",
      "name": "Beverley Park Golf Club",
      "region": "St George",
      "host": "beverleypark.miclub.com.au",
      "fee_group_id": "5268234",
      "holes": 18,
      "par": 70,
      "length_metres": null,
      "drive_minutes_from_bondi": 30,
      "requires_registration": false,
      "address": null,
      "notes": "",
      "sort_order": 8
    },
    {
      "slug": "warringah",
      "name": "Warringah Golf Club",
      "region": "Northern Beaches",
      "host": "warringah.miclub.com.au",
      "fee_group_id": "108003",
      "holes": 18,
      "par": 70,
      "length_metres": null,
      "drive_minutes_from_bondi": 32,
      "requires_registration": false,
      "address": "397 Condamine St, North Manly NSW",
      "notes": "",
      "sort_order": 9
    },
    {
      "slug": "castle-cove",
      "name": "Castle Cove Country Club",
      "region": "North Shore",
      "host": "www.castlecovegolf.com.au",
      "fee_group_id": "868752",
      "holes": 18,
      "par": 64,
      "length_metres": null,
      "drive_minutes_from_bondi": 35,
      "requires_registration": false,
      "address": null,
      "notes": "Members club — may have limited public availability.",
      "sort_order": 10
    },
    {
      "slug": "bayview",
      "name": "Bayview Golf Club",
      "region": "Northern Beaches",
      "host": "bayviewgolfclub.com.au",
      "fee_group_id": "2",
      "holes": 18,
      "par": 71,
      "length_metres": null,
      "drive_minutes_from_bondi": 42,
      "requires_registration": true,
      "address": null,
      "notes": "Mona Vale. Public bookings need a free account first.",
      "sort_order": 11
    },
    {
      "slug": "long-reef",
      "name": "Long Reef Golf Club",
      "region": "Northern Beaches",
      "host": "longreef.miclub.com.au",
      "fee_group_id": "3752188",
      "holes": 18,
      "par": 72,
      "length_metres": null,
      "drive_minutes_from_bondi": 45,
      "requires_registration": false,
      "address": null,
      "notes": "",
      "sort_order": 12
    },
    {
      "slug": "brighton-lakes",
      "name": "Brighton Lakes Recreation Club",
      "region": "South West",
      "host": "brightonlakes.miclub.com.au",
      "fee_group_id": "4328836",
      "holes": 18,
      "par": 72,
      "length_metres": null,
      "drive_minutes_from_bondi": 45,
      "requires_registration": false,
      "address": null,
      "notes": "Moorebank — longest drive on the list.",
      "sort_order": 13
    },
    {
      "slug": "bankstown",
      "name": "Bankstown Golf Club",
      "region": "South West",
      "host": "bankstown.miclub.com.au",
      "fee_group_id": "1509794765",
      "holes": 18,
      "par": 71,
      "length_metres": null,
      "drive_minutes_from_bondi": 45,
      "requires_registration": false,
      "address": "70 Ashford Ave, Milperra NSW",
      "notes": "",
      "sort_order": 14
    }
  ],
  "slots": [
    {
      "id": "warringah:2026-10-03:0616:1st-tee-social",
      "course_slug": "warringah",
      "course_name": "Warringah Golf Club",
      "region": "Northern Beaches",
      "drive_minutes_from_bondi": 32,
      "par": 70,
      "length_metres": null,
      "requires_registration": false,
      "tee_date": "2026-10-03",
      "tee_time": "06:16:00",
      "tee_at": "2026-10-03T06:16:00+10:00",
      "spots_available": 2,
      "total_spots": 4,
      "holes": 18,
      "price_min": null,
      "price_max": null,
      "price_tiers": [],
      "booking_type": "1st Tee Social",
      "booking_url": "https://warringah.miclub.com.au/guests/bookings/ViewPublicTimesheet.msp?bookingResourceId=3000000&feeGroupId=108003&selectedDate=2026-10-03"
    },
    {
      "id": "warringah:2026-10-03:0616:10th-tee-social",
      "course_slug": "warringah",
      "course_name": "Warringah Golf Club",
      "region": "Northern Beaches",
      "drive_minutes_from_bondi": 32,
      "par": 70,
      "length_metres": null,
      "requires_registration": false,
      "tee_date": "2026-10-03",
      "tee_time": "06:16:00",
      "tee_at": "2026-10-03T06:16:00+10:00",
      "spots_available": 4,
      "total_spots": 4,
      "holes": 18,
      "price_min": null,
      "price_max": null,
      "price_tiers": [],
      "booking_type": "10th Tee Social",
      "booking_url": "https://warringah.miclub.com.au/guests/bookings/ViewPublicTimesheet.msp?bookingResourceId=3000000&feeGroupId=108003&selectedDate=2026-10-03"
    },
    {
      "id": "woollahra:2026-10-03:0712:public-play",
      "course_slug": "woollahra",
      "course_name": "Woollahra Golf Club",
      "region": "Eastern Suburbs",
      "drive_minutes_from_bondi": 10,
      "par": 34,
      "length_metres": null,
      "requires_registration": false,
      "tee_date": "2026-10-03",
      "tee_time": "07:12:00",
      "tee_at": "2026-10-03T07:12:00+10:00",
      "spots_available": 1,
      "total_spots": 4,
      "holes": 9,
      "price_min": 45.0,
      "price_max": 45.0,
      "price_tiers": [
        {
          "label": "Weekend 2024",
          "amount": 45.0
        }
      ],
      "booking_type": "Public Play",
      "booking_url": "https://woollahra.miclub.com.au/guests/bookings/ViewPublicTimesheet.msp?bookingResourceId=3000000&feeGroupId=3050666&selectedDate=2026-10-03"
    },
    {
      "id": "the-coast:2026-10-03:0800:1st-tee",
      "course_slug": "the-coast",
      "course_name": "The Coast Golf Club",
      "region": "Eastern Suburbs",
      "drive_minutes_from_bondi": 25,
      "par": 71,
      "length_metres": null,
      "requires_registration": false,
      "tee_date": "2026-10-03",
      "tee_time": "08:00:00",
      "tee_at": "2026-10-03T08:00:00+10:00",
      "spots_available": 4,
      "total_spots": 4,
      "holes": 18,
      "price_min": 55.0,
      "price_max": 110.0,
      "price_tiers": [
        {
          "label": "Adult",
          "amount": 110.0
        },
        {
          "label": "Junior (U18 Only) - Proof of Age Required on Arrival",
          "amount": 55.0
        },
        {
          "label": "Senior Mid-Week 18 Holes",
          "amount": 88.0
        }
      ],
      "booking_type": "1st Tee",
      "booking_url": "https://www.coastgolf.com.au/guests/bookings/ViewPublicTimesheet.msp?bookingResourceId=3000000&feeGroupId=1508176600&selectedDate=2026-10-03"
    },
    {
      "id": "bankstown:2026-10-03:1120:social-play-9-holes-only",
      "course_slug": "bankstown",